{"digest":"2c98f7846767d3704ce5d645d6775883e8f510934962be17614544b1a797a448","engineVersion":"1.0.0","finalState":[{"key":"control:batch","value":2}],"invariants":[{"detail":"lhs=0 rhs=0","name":"The printed report matches the batch's final total","status":"holds"}],"level":"SER","scenario":{"id":"read-only-anomaly","invariants":[{"expr":"sum(r) == final.sum(\"receipt:1:\")","name":"The printed report matches the batch's final total"}],"story":"A shop closes the day's batch and prints a report. A receipt that started before the close gets filed into the already-reported batch.","title":"Read-Only Anomaly: a report that can never be right"},"schemaVersion":1,"serializable":{"verdict":true,"witnessOrder":["T3","T1"]},"setup":[{"key":"control:batch","value":1}],"steps":[{"args":{},"effects":[],"index":0,"note":null,"op":"BEGIN","reads":[],"resumed":false,"scheduledIndex":0,"snapshotTS":0,"status":"ok","stmtTS":0,"storeAfter":[],"storeFull":[{"key":"control:batch","versions":[{"commitTS":1,"deleted":false,"value":1,"writer":"T0"}]}],"txn":"T2"},{"args":{},"effects":[],"index":1,"note":null,"op":"BEGIN","reads":[],"resumed":false,"scheduledIndex":1,"snapshotTS":0,"status":"ok","stmtTS":0,"storeAfter":[],"txn":"T3"},{"args":{"as":"current","key":"control:batch"},"effects":[],"index":2,"note":null,"op":"READ","reads":[{"from":{"commitTS":1,"writer":"T0"},"key":"control:batch","why":"visible_committed_before_snapshot"}],"result":{"absent":false,"value":1},"resumed":false,"scheduledIndex":2,"snapshotTS":1,"status":"ok","stmtTS":1,"storeAfter":[],"txn":"T2"},{"args":{"as":"before_close","key":"control:batch"},"effects":[],"index":3,"note":null,"op":"READ","reads":[{"from":{"commitTS":1,"writer":"T0"},"key":"control:batch","why":"visible_committed_before_snapshot"}],"result":{"absent":false,"value":1},"resumed":false,"scheduledIndex":3,"snapshotTS":1,"status":"ok","stmtTS":1,"storeAfter":[],"txn":"T3"},{"args":{"expr":"before_close + 1","key":"control:batch","value":2},"effects":[{"key":"control:batch","kind":"lock_acquired","txn":"T3"},{"key":"control:batch","kind":"version_created","txn":"T3","value":2},{"from":"T2","kind":"rw_edge","reason":"rw_edge_added","to":"T3","via":"control:batch"}],"index":4,"note":null,"op":"PUT","reads":[],"resumed":false,"scheduledIndex":4,"snapshotTS":1,"status":"ok","stmtTS":1,"storeAfter":[{"key":"control:batch","versions":[{"commitTS":1,"deleted":false,"value":1,"writer":"T0"},{"commitTS":0,"deleted":false,"value":2,"writer":"T3"}]}],"txn":"T3"},{"args":{},"effects":[{"commitTS":2,"kind":"commit","txn":"T3"},{"key":"control:batch","kind":"lock_released","txn":"T3"}],"index":5,"note":null,"op":"COMMIT","reads":[],"resumed":false,"scheduledIndex":5,"snapshotTS":1,"status":"ok","stmtTS":0,"storeAfter":[{"key":"control:batch","versions":[{"commitTS":1,"deleted":false,"value":1,"writer":"T0"},{"commitTS":2,"deleted":false,"value":2,"writer":"T3"}]}],"txn":"T3"},{"args":{},"effects":[],"index":6,"note":null,"op":"BEGIN","reads":[],"resumed":false,"scheduledIndex":6,"snapshotTS":0,"status":"ok","stmtTS":0,"storeAfter":[],"txn":"T1"},{"args":{"as":"day","key":"control:batch"},"effects":[],"index":7,"note":null,"op":"READ","reads":[{"from":{"commitTS":2,"writer":"T3"},"key":"control:batch","why":"visible_committed_before_snapshot"}],"result":{"absent":false,"value":2},"resumed":false,"scheduledIndex":7,"snapshotTS":2,"status":"ok","stmtTS":2,"storeAfter":[],"txn":"T1"},{"args":{"as":"r","prefix":"receipt:1:"},"effects":[],"index":8,"note":null,"op":"SCAN","reads":[],"result":{"count":0,"rows":[],"sum":0},"resumed":false,"scheduledIndex":8,"snapshotTS":2,"status":"ok","stmtTS":2,"storeAfter":[],"txn":"T1"},{"args":{"text":"Batch 1 is closed; its report shows no receipts."},"effects":[],"index":9,"note":"Batch 1 is closed; its report shows no receipts.","op":"NOTE","reads":[],"resumed":false,"scheduledIndex":9,"snapshotTS":2,"status":"ok","stmtTS":0,"storeAfter":[],"txn":"T1"},{"args":{},"effects":[{"commitTS":3,"kind":"commit","txn":"T1"}],"index":10,"note":null,"op":"COMMIT","reads":[],"resumed":false,"scheduledIndex":10,"snapshotTS":2,"status":"ok","stmtTS":0,"storeAfter":[],"txn":"T1"},{"args":{"expr":"100","key":"receipt:1:r1","value":100},"effects":[{"key":"receipt:1:r1","kind":"lock_acquired","txn":"T2"},{"key":"receipt:1:r1","kind":"version_created","txn":"T2","value":100},{"from":"T1","kind":"rw_edge","reason":"rw_edge_added","to":"T2","via":"receipt:1:"},{"kind":"abort","reason":"abort_dependencies","txn":"T2"},{"key":"receipt:1:r1","kind":"lock_released","txn":"T2"}],"index":11,"note":null,"op":"PUT","reads":[],"reason":"abort_dependencies","resumed":false,"scheduledIndex":11,"snapshotTS":1,"status":"aborted","stmtTS":3,"storeAfter":[{"key":"receipt:1:r1","versions":[]}],"txn":"T2"},{"args":{},"effects":[],"index":12,"note":null,"op":"COMMIT","reads":[],"reason":"skipped_txn_aborted","resumed":false,"scheduledIndex":12,"snapshotTS":1,"status":"skipped","stmtTS":0,"storeAfter":[],"txn":"T2"}],"txns":[{"abortReason":null,"commitTS":3,"id":"T1","snapshotTS":2,"status":"committed"},{"abortReason":"abort_dependencies","commitTS":0,"id":"T2","snapshotTS":1,"status":"aborted"},{"abortReason":null,"commitTS":2,"id":"T3","snapshotTS":1,"status":"committed"}]}