{"digest":"358644a08e83bcf04f9521fddadf2828b4d0c47321516ec01345032579271b8a","engineVersion":"1.0.0","finalState":[{"key":"price","value":1}],"invariants":[{"detail":"lhs=1 rhs=1","name":"T2 only sees a committed price","status":"holds"}],"level":"SI","scenario":{"id":"dirty-read","invariants":[{"expr":"b == 1","name":"T2 only sees a committed price"}],"story":"T1 changes a price to 2 but has not committed. T2 reads the price. Then T1 changes its mind and aborts.","title":"Dirty Read: seeing a value that never existed"},"schemaVersion":1,"serializable":{"verdict":true,"witnessOrder":["T2"]},"setup":[{"key":"price","value":1}],"steps":[{"args":{},"effects":[],"index":0,"note":null,"op":"BEGIN","reads":[],"resumed":false,"scheduledIndex":0,"snapshotTS":0,"status":"ok","stmtTS":0,"storeAfter":[],"storeFull":[{"key":"price","versions":[{"commitTS":1,"deleted":false,"value":1,"writer":"T0"}]}],"txn":"T1"},{"args":{},"effects":[],"index":1,"note":null,"op":"BEGIN","reads":[],"resumed":false,"scheduledIndex":1,"snapshotTS":0,"status":"ok","stmtTS":0,"storeAfter":[],"txn":"T2"},{"args":{"expr":"2","key":"price","value":2},"effects":[{"key":"price","kind":"lock_acquired","txn":"T1"},{"key":"price","kind":"version_created","txn":"T1","value":2}],"index":2,"note":null,"op":"PUT","reads":[],"resumed":false,"scheduledIndex":2,"snapshotTS":1,"status":"ok","stmtTS":1,"storeAfter":[{"key":"price","versions":[{"commitTS":1,"deleted":false,"value":1,"writer":"T0"},{"commitTS":0,"deleted":false,"value":2,"writer":"T1"}]}],"txn":"T1"},{"args":{"as":"b","key":"price"},"effects":[],"index":3,"note":null,"op":"READ","reads":[{"from":{"commitTS":1,"writer":"T0"},"key":"price","why":"visible_committed_before_snapshot"},{"from":{"commitTS":0,"writer":"T1"},"key":"price","why":"invisible_uncommitted_other"}],"result":{"absent":false,"value":1},"resumed":false,"scheduledIndex":3,"snapshotTS":1,"status":"ok","stmtTS":1,"storeAfter":[],"txn":"T2"},{"args":{},"effects":[{"kind":"abort","reason":"abort_user","txn":"T1"},{"key":"price","kind":"lock_released","txn":"T1"}],"index":4,"note":null,"op":"ABORT","reads":[],"reason":"abort_user","resumed":false,"scheduledIndex":4,"snapshotTS":1,"status":"aborted","stmtTS":0,"storeAfter":[{"key":"price","versions":[{"commitTS":1,"deleted":false,"value":1,"writer":"T0"}]}],"txn":"T1"},{"args":{},"effects":[{"commitTS":2,"kind":"commit","txn":"T2"}],"index":5,"note":null,"op":"COMMIT","reads":[],"resumed":false,"scheduledIndex":5,"snapshotTS":1,"status":"ok","stmtTS":0,"storeAfter":[],"txn":"T2"}],"txns":[{"abortReason":"abort_user","commitTS":0,"id":"T1","snapshotTS":1,"status":"aborted"},{"abortReason":null,"commitTS":2,"id":"T2","snapshotTS":1,"status":"committed"}]}