{"digest":"fba73922f077c6c0a34aee61f75fec9b87a4957cd527ca74c67bff2dcafc2418","engineVersion":"1.0.0","finalState":[{"key":"control:batch","value":2},{"key":"receipt:1:r1","value":100}],"invariants":[{"detail":"lhs=0 rhs=100","name":"The printed report matches the batch's final total","status":"violated"}],"level":"RU","scenario":{"id":"read-only-anomaly","invariants":[{"expr":"sum(r) == final.sum(\"receipt:1:\")","name":"The printed report matches the batch's final total"}],"story":"A shop closes the day's batch and prints a report. A receipt that started before the close gets filed into the already-reported batch.","title":"Read-Only Anomaly: a report that can never be right"},"schemaVersion":1,"serializable":{"verdict":false,"witnessOrder":null},"setup":[{"key":"control:batch","value":1}],"steps":[{"args":{},"effects":[],"index":0,"note":null,"op":"BEGIN","reads":[],"resumed":false,"scheduledIndex":0,"snapshotTS":0,"status":"ok","stmtTS":0,"storeAfter":[{"key":"control:batch","versions":[{"commitTS":1,"deleted":false,"value":1,"writer":"T0"}]}],"txn":"T2"},{"args":{},"effects":[],"index":1,"note":null,"op":"BEGIN","reads":[],"resumed":false,"scheduledIndex":1,"snapshotTS":0,"status":"ok","stmtTS":0,"storeAfter":[{"key":"control:batch","versions":[{"commitTS":1,"deleted":false,"value":1,"writer":"T0"}]}],"txn":"T3"},{"args":{"as":"current","key":"control:batch"},"effects":[],"index":2,"note":null,"op":"READ","reads":[{"from":{"commitTS":1,"writer":"T0"},"key":"control:batch","why":"visible_committed_at_statement"}],"result":{"absent":false,"value":1},"resumed":false,"scheduledIndex":2,"snapshotTS":0,"status":"ok","stmtTS":1,"storeAfter":[{"key":"control:batch","versions":[{"commitTS":1,"deleted":false,"value":1,"writer":"T0"}]}],"txn":"T2"},{"args":{"as":"before_close","key":"control:batch"},"effects":[],"index":3,"note":null,"op":"READ","reads":[{"from":{"commitTS":1,"writer":"T0"},"key":"control:batch","why":"visible_committed_at_statement"}],"result":{"absent":false,"value":1},"resumed":false,"scheduledIndex":3,"snapshotTS":0,"status":"ok","stmtTS":1,"storeAfter":[{"key":"control:batch","versions":[{"commitTS":1,"deleted":false,"value":1,"writer":"T0"}]}],"txn":"T3"},{"args":{"expr":"before_close + 1","key":"control:batch","value":2},"effects":[{"key":"control:batch","kind":"lock_acquired","txn":"T3"},{"key":"control:batch","kind":"version_created","txn":"T3","value":2}],"index":4,"note":null,"op":"PUT","reads":[],"resumed":false,"scheduledIndex":4,"snapshotTS":0,"status":"ok","stmtTS":1,"storeAfter":[{"key":"control:batch","versions":[{"commitTS":1,"deleted":false,"value":1,"writer":"T0"},{"commitTS":0,"deleted":false,"value":2,"writer":"T3"}]}],"txn":"T3"},{"args":{},"effects":[{"commitTS":2,"kind":"commit","txn":"T3"},{"key":"control:batch","kind":"lock_released","txn":"T3"}],"index":5,"note":null,"op":"COMMIT","reads":[],"resumed":false,"scheduledIndex":5,"snapshotTS":0,"status":"ok","stmtTS":0,"storeAfter":[{"key":"control:batch","versions":[{"commitTS":1,"deleted":false,"value":1,"writer":"T0"},{"commitTS":2,"deleted":false,"value":2,"writer":"T3"}]}],"txn":"T3"},{"args":{},"effects":[],"index":6,"note":null,"op":"BEGIN","reads":[],"resumed":false,"scheduledIndex":6,"snapshotTS":0,"status":"ok","stmtTS":0,"storeAfter":[{"key":"control:batch","versions":[{"commitTS":1,"deleted":false,"value":1,"writer":"T0"},{"commitTS":2,"deleted":false,"value":2,"writer":"T3"}]}],"txn":"T1"},{"args":{"as":"day","key":"control:batch"},"effects":[],"index":7,"note":null,"op":"READ","reads":[{"from":{"commitTS":2,"writer":"T3"},"key":"control:batch","why":"visible_committed_at_statement"}],"result":{"absent":false,"value":2},"resumed":false,"scheduledIndex":7,"snapshotTS":0,"status":"ok","stmtTS":2,"storeAfter":[{"key":"control:batch","versions":[{"commitTS":1,"deleted":false,"value":1,"writer":"T0"},{"commitTS":2,"deleted":false,"value":2,"writer":"T3"}]}],"txn":"T1"},{"args":{"as":"r","prefix":"receipt:1:"},"effects":[],"index":8,"note":null,"op":"SCAN","reads":[],"result":{"count":0,"rows":[],"sum":0},"resumed":false,"scheduledIndex":8,"snapshotTS":0,"status":"ok","stmtTS":2,"storeAfter":[{"key":"control:batch","versions":[{"commitTS":1,"deleted":false,"value":1,"writer":"T0"},{"commitTS":2,"deleted":false,"value":2,"writer":"T3"}]}],"txn":"T1"},{"args":{"text":"Batch 1 is closed; its report shows no receipts."},"effects":[],"index":9,"note":"Batch 1 is closed; its report shows no receipts.","op":"NOTE","reads":[],"resumed":false,"scheduledIndex":9,"snapshotTS":0,"status":"ok","stmtTS":0,"storeAfter":[{"key":"control:batch","versions":[{"commitTS":1,"deleted":false,"value":1,"writer":"T0"},{"commitTS":2,"deleted":false,"value":2,"writer":"T3"}]}],"txn":"T1"},{"args":{},"effects":[{"commitTS":3,"kind":"commit","txn":"T1"}],"index":10,"note":null,"op":"COMMIT","reads":[],"resumed":false,"scheduledIndex":10,"snapshotTS":0,"status":"ok","stmtTS":0,"storeAfter":[{"key":"control:batch","versions":[{"commitTS":1,"deleted":false,"value":1,"writer":"T0"},{"commitTS":2,"deleted":false,"value":2,"writer":"T3"}]}],"txn":"T1"},{"args":{"expr":"100","key":"receipt:1:r1","value":100},"effects":[{"key":"receipt:1:r1","kind":"lock_acquired","txn":"T2"},{"key":"receipt:1:r1","kind":"version_created","txn":"T2","value":100}],"index":11,"note":null,"op":"PUT","reads":[],"resumed":false,"scheduledIndex":11,"snapshotTS":0,"status":"ok","stmtTS":3,"storeAfter":[{"key":"control:batch","versions":[{"commitTS":1,"deleted":false,"value":1,"writer":"T0"},{"commitTS":2,"deleted":false,"value":2,"writer":"T3"}]},{"key":"receipt:1:r1","versions":[{"commitTS":0,"deleted":false,"value":100,"writer":"T2"}]}],"txn":"T2"},{"args":{},"effects":[{"commitTS":4,"kind":"commit","txn":"T2"},{"key":"receipt:1:r1","kind":"lock_released","txn":"T2"}],"index":12,"note":null,"op":"COMMIT","reads":[],"resumed":false,"scheduledIndex":12,"snapshotTS":0,"status":"ok","stmtTS":0,"storeAfter":[{"key":"control:batch","versions":[{"commitTS":1,"deleted":false,"value":1,"writer":"T0"},{"commitTS":2,"deleted":false,"value":2,"writer":"T3"}]},{"key":"receipt:1:r1","versions":[{"commitTS":4,"deleted":false,"value":100,"writer":"T2"}]}],"txn":"T2"}],"txns":[{"abortReason":null,"commitTS":3,"id":"T1","snapshotTS":0,"status":"committed"},{"abortReason":null,"commitTS":4,"id":"T2","snapshotTS":0,"status":"committed"},{"abortReason":null,"commitTS":2,"id":"T3","snapshotTS":0,"status":"committed"}]}