{"digest":"908fb33fe639da983f1c6cc0dd87399dcb175fcd3b268df7ca254f68a9078cc5","engineVersion":"1.0.0","finalState":[{"key":"acct:checking","value":25},{"key":"acct:savings","value":75}],"invariants":[{"detail":"lhs=100 rhs=100","name":"T1 computes a total of 100","status":"holds"}],"level":"SER","scenario":{"id":"read-skew","invariants":[{"expr":"checking + savings == 100","name":"T1 computes a total of 100"}],"story":"Alice has 50 in checking and 50 in savings. T1 reads both to compute her total. In between, T2 moves 25 from checking to savings.","title":"Read Skew: a total that does not add up"},"schemaVersion":1,"serializable":{"verdict":true,"witnessOrder":["T1","T2"]},"setup":[{"key":"acct:checking","value":50},{"key":"acct:savings","value":50}],"steps":[{"args":{},"effects":[],"index":0,"note":null,"op":"BEGIN","reads":[],"resumed":false,"scheduledIndex":0,"snapshotTS":0,"status":"ok","stmtTS":0,"storeAfter":[],"storeFull":[{"key":"acct:checking","versions":[{"commitTS":1,"deleted":false,"value":50,"writer":"T0"}]},{"key":"acct:savings","versions":[{"commitTS":1,"deleted":false,"value":50,"writer":"T0"}]}],"txn":"T1"},{"args":{},"effects":[],"index":1,"note":null,"op":"BEGIN","reads":[],"resumed":false,"scheduledIndex":1,"snapshotTS":0,"status":"ok","stmtTS":0,"storeAfter":[],"txn":"T2"},{"args":{"as":"checking","key":"acct:checking"},"effects":[],"index":2,"note":null,"op":"READ","reads":[{"from":{"commitTS":1,"writer":"T0"},"key":"acct:checking","why":"visible_committed_before_snapshot"}],"result":{"absent":false,"value":50},"resumed":false,"scheduledIndex":2,"snapshotTS":1,"status":"ok","stmtTS":1,"storeAfter":[],"txn":"T1"},{"args":{"expr":"25","key":"acct:checking","value":25},"effects":[{"key":"acct:checking","kind":"lock_acquired","txn":"T2"},{"key":"acct:checking","kind":"version_created","txn":"T2","value":25},{"from":"T1","kind":"rw_edge","reason":"rw_edge_added","to":"T2","via":"acct:checking"}],"index":3,"note":null,"op":"PUT","reads":[],"resumed":false,"scheduledIndex":3,"snapshotTS":1,"status":"ok","stmtTS":1,"storeAfter":[{"key":"acct:checking","versions":[{"commitTS":1,"deleted":false,"value":50,"writer":"T0"},{"commitTS":0,"deleted":false,"value":25,"writer":"T2"}]}],"txn":"T2"},{"args":{"expr":"75","key":"acct:savings","value":75},"effects":[{"key":"acct:savings","kind":"lock_acquired","txn":"T2"},{"key":"acct:savings","kind":"version_created","txn":"T2","value":75}],"index":4,"note":null,"op":"PUT","reads":[],"resumed":false,"scheduledIndex":4,"snapshotTS":1,"status":"ok","stmtTS":1,"storeAfter":[{"key":"acct:savings","versions":[{"commitTS":1,"deleted":false,"value":50,"writer":"T0"},{"commitTS":0,"deleted":false,"value":75,"writer":"T2"}]}],"txn":"T2"},{"args":{},"effects":[{"commitTS":2,"kind":"commit","txn":"T2"},{"key":"acct:checking","kind":"lock_released","txn":"T2"},{"key":"acct:savings","kind":"lock_released","txn":"T2"}],"index":5,"note":null,"op":"COMMIT","reads":[],"resumed":false,"scheduledIndex":5,"snapshotTS":1,"status":"ok","stmtTS":0,"storeAfter":[{"key":"acct:checking","versions":[{"commitTS":1,"deleted":false,"value":50,"writer":"T0"},{"commitTS":2,"deleted":false,"value":25,"writer":"T2"}]},{"key":"acct:savings","versions":[{"commitTS":1,"deleted":false,"value":50,"writer":"T0"},{"commitTS":2,"deleted":false,"value":75,"writer":"T2"}]}],"txn":"T2"},{"args":{"as":"savings","key":"acct:savings"},"effects":[],"index":6,"note":null,"op":"READ","reads":[{"from":{"commitTS":1,"writer":"T0"},"key":"acct:savings","why":"visible_committed_before_snapshot"},{"from":{"commitTS":2,"writer":"T2"},"key":"acct:savings","why":"invisible_newer_than_snapshot"}],"result":{"absent":false,"value":50},"resumed":false,"scheduledIndex":6,"snapshotTS":1,"status":"ok","stmtTS":2,"storeAfter":[],"txn":"T1"},{"args":{},"effects":[{"commitTS":3,"kind":"commit","txn":"T1"}],"index":7,"note":null,"op":"COMMIT","reads":[],"resumed":false,"scheduledIndex":7,"snapshotTS":1,"status":"ok","stmtTS":0,"storeAfter":[],"txn":"T1"}],"txns":[{"abortReason":null,"commitTS":3,"id":"T1","snapshotTS":1,"status":"committed"},{"abortReason":null,"commitTS":2,"id":"T2","snapshotTS":1,"status":"committed"}]}