{"digest":"762fece9ea382673129f03e893c6febaf52b1b2062ce83cde34914cf5d8319f3","engineVersion":"1.0.0","finalState":[{"key":"a","value":2},{"key":"b","value":3}],"invariants":[{"detail":"lhs=1 rhs=2","name":"Both transactions complete","status":"violated"}],"level":"SER","scenario":{"id":"deadlock","invariants":[{"expr":"committed(T1) + committed(T2) == 2","name":"Both transactions complete"}],"story":"T1 locks a then wants b. T2 locks b then wants a. Neither can continue.","title":"Deadlock: two transactions waiting on each other"},"schemaVersion":1,"serializable":{"verdict":true,"witnessOrder":["T1"]},"setup":[{"key":"a","value":1},{"key":"b","value":1}],"steps":[{"args":{},"effects":[],"index":0,"note":null,"op":"BEGIN","reads":[],"resumed":false,"scheduledIndex":0,"snapshotTS":0,"status":"ok","stmtTS":0,"storeAfter":[{"key":"a","versions":[{"commitTS":1,"deleted":false,"value":1,"writer":"T0"}]},{"key":"b","versions":[{"commitTS":1,"deleted":false,"value":1,"writer":"T0"}]}],"txn":"T1"},{"args":{},"effects":[],"index":1,"note":null,"op":"BEGIN","reads":[],"resumed":false,"scheduledIndex":1,"snapshotTS":0,"status":"ok","stmtTS":0,"storeAfter":[{"key":"a","versions":[{"commitTS":1,"deleted":false,"value":1,"writer":"T0"}]},{"key":"b","versions":[{"commitTS":1,"deleted":false,"value":1,"writer":"T0"}]}],"txn":"T2"},{"args":{"expr":"2","key":"a","value":2},"effects":[{"key":"a","kind":"lock_acquired","txn":"T1"},{"key":"a","kind":"version_created","txn":"T1","value":2}],"index":2,"note":null,"op":"PUT","reads":[],"resumed":false,"scheduledIndex":2,"snapshotTS":1,"status":"ok","stmtTS":1,"storeAfter":[{"key":"a","versions":[{"commitTS":1,"deleted":false,"value":1,"writer":"T0"},{"commitTS":0,"deleted":false,"value":2,"writer":"T1"}]},{"key":"b","versions":[{"commitTS":1,"deleted":false,"value":1,"writer":"T0"}]}],"txn":"T1"},{"args":{"expr":"2","key":"b","value":2},"effects":[{"key":"b","kind":"lock_acquired","txn":"T2"},{"key":"b","kind":"version_created","txn":"T2","value":2}],"index":3,"note":null,"op":"PUT","reads":[],"resumed":false,"scheduledIndex":3,"snapshotTS":1,"status":"ok","stmtTS":1,"storeAfter":[{"key":"a","versions":[{"commitTS":1,"deleted":false,"value":1,"writer":"T0"},{"commitTS":0,"deleted":false,"value":2,"writer":"T1"}]},{"key":"b","versions":[{"commitTS":1,"deleted":false,"value":1,"writer":"T0"},{"commitTS":0,"deleted":false,"value":2,"writer":"T2"}]}],"txn":"T2"},{"args":{"expr":"3","key":"b","value":3},"blockedOn":"T2","effects":[{"holder":"T2","key":"b","kind":"lock_wait","txn":"T1"}],"index":4,"note":null,"op":"PUT","reads":[],"reason":"blocked_on_lock","resumed":false,"scheduledIndex":4,"snapshotTS":1,"status":"blocked","stmtTS":1,"storeAfter":[{"key":"a","versions":[{"commitTS":1,"deleted":false,"value":1,"writer":"T0"},{"commitTS":0,"deleted":false,"value":2,"writer":"T1"}]},{"key":"b","versions":[{"commitTS":1,"deleted":false,"value":1,"writer":"T0"},{"commitTS":0,"deleted":false,"value":2,"writer":"T2"}]}],"txn":"T1"},{"args":{"expr":"3","key":"a","value":3},"effects":[{"kind":"abort","reason":"abort_deadlock","txn":"T2"},{"key":"b","kind":"lock_released","txn":"T2"}],"index":5,"note":null,"op":"PUT","reads":[],"reason":"abort_deadlock","resumed":false,"scheduledIndex":5,"snapshotTS":1,"status":"aborted","stmtTS":1,"storeAfter":[{"key":"a","versions":[{"commitTS":1,"deleted":false,"value":1,"writer":"T0"},{"commitTS":0,"deleted":false,"value":2,"writer":"T1"}]},{"key":"b","versions":[{"commitTS":1,"deleted":false,"value":1,"writer":"T0"}]}],"txn":"T2"},{"args":{"expr":"3","key":"b","value":3},"effects":[{"key":"b","kind":"lock_acquired","reason":"lock_granted_after_wait","txn":"T1"},{"key":"b","kind":"version_created","txn":"T1","value":3}],"index":6,"note":null,"op":"PUT","reads":[],"resumed":true,"scheduledIndex":4,"snapshotTS":1,"status":"ok","stmtTS":1,"storeAfter":[{"key":"a","versions":[{"commitTS":1,"deleted":false,"value":1,"writer":"T0"},{"commitTS":0,"deleted":false,"value":2,"writer":"T1"}]},{"key":"b","versions":[{"commitTS":1,"deleted":false,"value":1,"writer":"T0"},{"commitTS":0,"deleted":false,"value":3,"writer":"T1"}]}],"txn":"T1"},{"args":{},"effects":[{"commitTS":2,"kind":"commit","txn":"T1"},{"key":"a","kind":"lock_released","txn":"T1"},{"key":"b","kind":"lock_released","txn":"T1"}],"index":7,"note":null,"op":"COMMIT","reads":[],"resumed":false,"scheduledIndex":6,"snapshotTS":1,"status":"ok","stmtTS":0,"storeAfter":[{"key":"a","versions":[{"commitTS":1,"deleted":false,"value":1,"writer":"T0"},{"commitTS":2,"deleted":false,"value":2,"writer":"T1"}]},{"key":"b","versions":[{"commitTS":1,"deleted":false,"value":1,"writer":"T0"},{"commitTS":2,"deleted":false,"value":3,"writer":"T1"}]}],"txn":"T1"},{"args":{},"effects":[],"index":8,"note":null,"op":"COMMIT","reads":[],"reason":"skipped_txn_aborted","resumed":false,"scheduledIndex":7,"snapshotTS":1,"status":"skipped","stmtTS":0,"storeAfter":[{"key":"a","versions":[{"commitTS":1,"deleted":false,"value":1,"writer":"T0"},{"commitTS":2,"deleted":false,"value":2,"writer":"T1"}]},{"key":"b","versions":[{"commitTS":1,"deleted":false,"value":1,"writer":"T0"},{"commitTS":2,"deleted":false,"value":3,"writer":"T1"}]}],"txn":"T2"}],"txns":[{"abortReason":null,"commitTS":2,"id":"T1","snapshotTS":1,"status":"committed"},{"abortReason":"abort_deadlock","commitTS":0,"id":"T2","snapshotTS":1,"status":"aborted"}]}