{"digest":"eedc3f4ec21a0f1f0234ffb26fa1bbf7737514772747ee5e3ded7fa4601504a9","engineVersion":"1.0.0","finalState":[{"key":"balance","value":130}],"invariants":[{"detail":"lhs=130 rhs=180","name":"Every committed deposit is in the balance","status":"violated"}],"level":"RU","scenario":{"id":"lost-update","invariants":[{"expr":"final.val(\"balance\") == 100 + 50 * committed(T1) + 30 * committed(T2)","name":"Every committed deposit is in the balance"}],"story":"T1 and T2 both read a balance of 100, then each adds a deposit (+50 and +30). Both read before either writes.","title":"Lost Update: two deposits, one survives"},"schemaVersion":1,"serializable":{"verdict":false,"witnessOrder":null},"setup":[{"key":"balance","value":100}],"steps":[{"args":{},"effects":[],"index":0,"note":null,"op":"BEGIN","reads":[],"resumed":false,"scheduledIndex":0,"snapshotTS":0,"status":"ok","stmtTS":0,"storeAfter":[],"storeFull":[{"key":"balance","versions":[{"commitTS":1,"deleted":false,"value":100,"writer":"T0"}]}],"txn":"T1"},{"args":{},"effects":[],"index":1,"note":null,"op":"BEGIN","reads":[],"resumed":false,"scheduledIndex":1,"snapshotTS":0,"status":"ok","stmtTS":0,"storeAfter":[],"txn":"T2"},{"args":{"as":"a","key":"balance"},"effects":[],"index":2,"note":null,"op":"READ","reads":[{"from":{"commitTS":1,"writer":"T0"},"key":"balance","why":"visible_committed_at_statement"}],"result":{"absent":false,"value":100},"resumed":false,"scheduledIndex":2,"snapshotTS":0,"status":"ok","stmtTS":1,"storeAfter":[],"txn":"T1"},{"args":{"as":"b","key":"balance"},"effects":[],"index":3,"note":null,"op":"READ","reads":[{"from":{"commitTS":1,"writer":"T0"},"key":"balance","why":"visible_committed_at_statement"}],"result":{"absent":false,"value":100},"resumed":false,"scheduledIndex":3,"snapshotTS":0,"status":"ok","stmtTS":1,"storeAfter":[],"txn":"T2"},{"args":{"expr":"a + 50","key":"balance","value":150},"effects":[{"key":"balance","kind":"lock_acquired","txn":"T1"},{"key":"balance","kind":"version_created","txn":"T1","value":150}],"index":4,"note":null,"op":"PUT","reads":[],"resumed":false,"scheduledIndex":4,"snapshotTS":0,"status":"ok","stmtTS":1,"storeAfter":[{"key":"balance","versions":[{"commitTS":1,"deleted":false,"value":100,"writer":"T0"},{"commitTS":0,"deleted":false,"value":150,"writer":"T1"}]}],"txn":"T1"},{"args":{"expr":"b + 30","key":"balance","value":130},"blockedOn":"T1","effects":[{"holder":"T1","key":"balance","kind":"lock_wait","txn":"T2"}],"index":5,"note":null,"op":"PUT","reads":[],"reason":"blocked_on_lock","resumed":false,"scheduledIndex":5,"snapshotTS":0,"status":"blocked","stmtTS":1,"storeAfter":[],"txn":"T2"},{"args":{},"effects":[{"commitTS":2,"kind":"commit","txn":"T1"},{"key":"balance","kind":"lock_released","txn":"T1"}],"index":6,"note":null,"op":"COMMIT","reads":[],"resumed":false,"scheduledIndex":6,"snapshotTS":0,"status":"ok","stmtTS":0,"storeAfter":[{"key":"balance","versions":[{"commitTS":1,"deleted":false,"value":100,"writer":"T0"},{"commitTS":2,"deleted":false,"value":150,"writer":"T1"}]}],"txn":"T1"},{"args":{"expr":"b + 30","key":"balance","value":130},"effects":[{"key":"balance","kind":"lock_acquired","reason":"lock_granted_after_wait","txn":"T2"},{"key":"balance","kind":"version_created","txn":"T2","value":130}],"index":7,"note":null,"op":"PUT","reads":[],"resumed":true,"scheduledIndex":5,"snapshotTS":0,"status":"ok","stmtTS":2,"storeAfter":[{"key":"balance","versions":[{"commitTS":1,"deleted":false,"value":100,"writer":"T0"},{"commitTS":2,"deleted":false,"value":150,"writer":"T1"},{"commitTS":0,"deleted":false,"value":130,"writer":"T2"}]}],"txn":"T2"},{"args":{},"effects":[{"commitTS":3,"kind":"commit","txn":"T2"},{"key":"balance","kind":"lock_released","txn":"T2"}],"index":8,"note":null,"op":"COMMIT","reads":[],"resumed":false,"scheduledIndex":7,"snapshotTS":0,"status":"ok","stmtTS":0,"storeAfter":[{"key":"balance","versions":[{"commitTS":1,"deleted":false,"value":100,"writer":"T0"},{"commitTS":2,"deleted":false,"value":150,"writer":"T1"},{"commitTS":3,"deleted":false,"value":130,"writer":"T2"}]}],"txn":"T2"}],"txns":[{"abortReason":null,"commitTS":2,"id":"T1","snapshotTS":0,"status":"committed"},{"abortReason":null,"commitTS":3,"id":"T2","snapshotTS":0,"status":"committed"}]}