{"digest":"a0b9741399f517b417596fd2d25ea1684e6ac96dda0985cd1d26c17d7f515729","engineVersion":"1.0.0","finalState":[{"key":"doctor:alice","value":0},{"key":"doctor:bob","value":0}],"invariants":[{"detail":"lhs=0 rhs=1","name":"At least one doctor stays on call","status":"violated"}],"level":"RC","scenario":{"id":"write-skew","invariants":[{"expr":"final.count(\"doctor:\" WHERE == 1) >= 1","name":"At least one doctor stays on call"}],"story":"A hospital needs at least one doctor on call. Alice and Bob are both on call. Each checks that the other is on call, then goes off call.","title":"Write Skew: the hospital with no doctor on call"},"schemaVersion":1,"serializable":{"verdict":false,"witnessOrder":null},"setup":[{"key":"doctor:alice","value":1},{"key":"doctor:bob","value":1}],"steps":[{"args":{},"effects":[],"index":0,"note":null,"op":"BEGIN","reads":[],"resumed":false,"scheduledIndex":0,"snapshotTS":0,"status":"ok","stmtTS":0,"storeAfter":[{"key":"doctor:alice","versions":[{"commitTS":1,"deleted":false,"value":1,"writer":"T0"}]},{"key":"doctor:bob","versions":[{"commitTS":1,"deleted":false,"value":1,"writer":"T0"}]}],"txn":"T1"},{"args":{},"effects":[],"index":1,"note":null,"op":"BEGIN","reads":[],"resumed":false,"scheduledIndex":1,"snapshotTS":0,"status":"ok","stmtTS":0,"storeAfter":[{"key":"doctor:alice","versions":[{"commitTS":1,"deleted":false,"value":1,"writer":"T0"}]},{"key":"doctor:bob","versions":[{"commitTS":1,"deleted":false,"value":1,"writer":"T0"}]}],"txn":"T2"},{"args":{"as":"on_t1","prefix":"doctor:","where":{"cmp":"==","value":1}},"effects":[],"index":2,"note":null,"op":"SCAN","reads":[{"from":{"commitTS":1,"writer":"T0"},"key":"doctor:alice","why":"visible_committed_at_statement"},{"from":{"commitTS":1,"writer":"T0"},"key":"doctor:bob","why":"visible_committed_at_statement"}],"result":{"count":2,"rows":[{"key":"doctor:alice","value":1},{"key":"doctor:bob","value":1}],"sum":2},"resumed":false,"scheduledIndex":2,"snapshotTS":0,"status":"ok","stmtTS":1,"storeAfter":[{"key":"doctor:alice","versions":[{"commitTS":1,"deleted":false,"value":1,"writer":"T0"}]},{"key":"doctor:bob","versions":[{"commitTS":1,"deleted":false,"value":1,"writer":"T0"}]}],"txn":"T1"},{"args":{"as":"on_t2","prefix":"doctor:","where":{"cmp":"==","value":1}},"effects":[],"index":3,"note":null,"op":"SCAN","reads":[{"from":{"commitTS":1,"writer":"T0"},"key":"doctor:alice","why":"visible_committed_at_statement"},{"from":{"commitTS":1,"writer":"T0"},"key":"doctor:bob","why":"visible_committed_at_statement"}],"result":{"count":2,"rows":[{"key":"doctor:alice","value":1},{"key":"doctor:bob","value":1}],"sum":2},"resumed":false,"scheduledIndex":3,"snapshotTS":0,"status":"ok","stmtTS":1,"storeAfter":[{"key":"doctor:alice","versions":[{"commitTS":1,"deleted":false,"value":1,"writer":"T0"}]},{"key":"doctor:bob","versions":[{"commitTS":1,"deleted":false,"value":1,"writer":"T0"}]}],"txn":"T2"},{"args":{"text":"Two are on call, so Alice can leave."},"effects":[],"index":4,"note":"Two are on call, so Alice can leave.","op":"NOTE","reads":[],"resumed":false,"scheduledIndex":4,"snapshotTS":0,"status":"ok","stmtTS":0,"storeAfter":[{"key":"doctor:alice","versions":[{"commitTS":1,"deleted":false,"value":1,"writer":"T0"}]},{"key":"doctor:bob","versions":[{"commitTS":1,"deleted":false,"value":1,"writer":"T0"}]}],"txn":"T1"},{"args":{"text":"Two are on call, so Bob can leave."},"effects":[],"index":5,"note":"Two are on call, so Bob can leave.","op":"NOTE","reads":[],"resumed":false,"scheduledIndex":5,"snapshotTS":0,"status":"ok","stmtTS":0,"storeAfter":[{"key":"doctor:alice","versions":[{"commitTS":1,"deleted":false,"value":1,"writer":"T0"}]},{"key":"doctor:bob","versions":[{"commitTS":1,"deleted":false,"value":1,"writer":"T0"}]}],"txn":"T2"},{"args":{"expr":"0","key":"doctor:alice","value":0},"effects":[{"key":"doctor:alice","kind":"lock_acquired","txn":"T1"},{"key":"doctor:alice","kind":"version_created","txn":"T1","value":0}],"index":6,"note":null,"op":"PUT","reads":[],"resumed":false,"scheduledIndex":6,"snapshotTS":0,"status":"ok","stmtTS":1,"storeAfter":[{"key":"doctor:alice","versions":[{"commitTS":1,"deleted":false,"value":1,"writer":"T0"},{"commitTS":0,"deleted":false,"value":0,"writer":"T1"}]},{"key":"doctor:bob","versions":[{"commitTS":1,"deleted":false,"value":1,"writer":"T0"}]}],"txn":"T1"},{"args":{"expr":"0","key":"doctor:bob","value":0},"effects":[{"key":"doctor:bob","kind":"lock_acquired","txn":"T2"},{"key":"doctor:bob","kind":"version_created","txn":"T2","value":0}],"index":7,"note":null,"op":"PUT","reads":[],"resumed":false,"scheduledIndex":7,"snapshotTS":0,"status":"ok","stmtTS":1,"storeAfter":[{"key":"doctor:alice","versions":[{"commitTS":1,"deleted":false,"value":1,"writer":"T0"},{"commitTS":0,"deleted":false,"value":0,"writer":"T1"}]},{"key":"doctor:bob","versions":[{"commitTS":1,"deleted":false,"value":1,"writer":"T0"},{"commitTS":0,"deleted":false,"value":0,"writer":"T2"}]}],"txn":"T2"},{"args":{},"effects":[{"commitTS":2,"kind":"commit","txn":"T1"},{"key":"doctor:alice","kind":"lock_released","txn":"T1"}],"index":8,"note":null,"op":"COMMIT","reads":[],"resumed":false,"scheduledIndex":8,"snapshotTS":0,"status":"ok","stmtTS":0,"storeAfter":[{"key":"doctor:alice","versions":[{"commitTS":1,"deleted":false,"value":1,"writer":"T0"},{"commitTS":2,"deleted":false,"value":0,"writer":"T1"}]},{"key":"doctor:bob","versions":[{"commitTS":1,"deleted":false,"value":1,"writer":"T0"},{"commitTS":0,"deleted":false,"value":0,"writer":"T2"}]}],"txn":"T1"},{"args":{},"effects":[{"commitTS":3,"kind":"commit","txn":"T2"},{"key":"doctor:bob","kind":"lock_released","txn":"T2"}],"index":9,"note":null,"op":"COMMIT","reads":[],"resumed":false,"scheduledIndex":9,"snapshotTS":0,"status":"ok","stmtTS":0,"storeAfter":[{"key":"doctor:alice","versions":[{"commitTS":1,"deleted":false,"value":1,"writer":"T0"},{"commitTS":2,"deleted":false,"value":0,"writer":"T1"}]},{"key":"doctor:bob","versions":[{"commitTS":1,"deleted":false,"value":1,"writer":"T0"},{"commitTS":3,"deleted":false,"value":0,"writer":"T2"}]}],"txn":"T2"}],"txns":[{"abortReason":null,"commitTS":2,"id":"T1","snapshotTS":0,"status":"committed"},{"abortReason":null,"commitTS":3,"id":"T2","snapshotTS":0,"status":"committed"}]}