{"digest":"2117a81444e14d78072f75e59b3e5f9c930addaaba1064be77a6904cc95d93b4","engineVersion":"1.0.0","finalState":[{"key":"balance:alice","value":150}],"invariants":[{"detail":"lhs=100 rhs=150","name":"T1 sees one balance for its whole transaction","status":"violated"}],"level":"RU","scenario":{"id":"non-repeatable-read","invariants":[{"expr":"first == second","name":"T1 sees one balance for its whole transaction"}],"story":"T1 reads Alice's balance twice. In between, T2 deposits money and commits.","title":"Non-Repeatable Read: the same question, two answers"},"schemaVersion":1,"serializable":{"verdict":false,"witnessOrder":null},"setup":[{"key":"balance:alice","value":100}],"steps":[{"args":{},"effects":[],"index":0,"note":null,"op":"BEGIN","reads":[],"resumed":false,"scheduledIndex":0,"snapshotTS":0,"status":"ok","stmtTS":0,"storeAfter":[{"key":"balance:alice","versions":[{"commitTS":1,"deleted":false,"value":100,"writer":"T0"}]}],"txn":"T1"},{"args":{},"effects":[],"index":1,"note":null,"op":"BEGIN","reads":[],"resumed":false,"scheduledIndex":1,"snapshotTS":0,"status":"ok","stmtTS":0,"storeAfter":[{"key":"balance:alice","versions":[{"commitTS":1,"deleted":false,"value":100,"writer":"T0"}]}],"txn":"T2"},{"args":{"as":"first","key":"balance:alice"},"effects":[],"index":2,"note":null,"op":"READ","reads":[{"from":{"commitTS":1,"writer":"T0"},"key":"balance:alice","why":"visible_committed_at_statement"}],"result":{"absent":false,"value":100},"resumed":false,"scheduledIndex":2,"snapshotTS":0,"status":"ok","stmtTS":1,"storeAfter":[{"key":"balance:alice","versions":[{"commitTS":1,"deleted":false,"value":100,"writer":"T0"}]}],"txn":"T1"},{"args":{"expr":"150","key":"balance:alice","value":150},"effects":[{"key":"balance:alice","kind":"lock_acquired","txn":"T2"},{"key":"balance:alice","kind":"version_created","txn":"T2","value":150}],"index":3,"note":null,"op":"PUT","reads":[],"resumed":false,"scheduledIndex":3,"snapshotTS":0,"status":"ok","stmtTS":1,"storeAfter":[{"key":"balance:alice","versions":[{"commitTS":1,"deleted":false,"value":100,"writer":"T0"},{"commitTS":0,"deleted":false,"value":150,"writer":"T2"}]}],"txn":"T2"},{"args":{},"effects":[{"commitTS":2,"kind":"commit","txn":"T2"},{"key":"balance:alice","kind":"lock_released","txn":"T2"}],"index":4,"note":null,"op":"COMMIT","reads":[],"resumed":false,"scheduledIndex":4,"snapshotTS":0,"status":"ok","stmtTS":0,"storeAfter":[{"key":"balance:alice","versions":[{"commitTS":1,"deleted":false,"value":100,"writer":"T0"},{"commitTS":2,"deleted":false,"value":150,"writer":"T2"}]}],"txn":"T2"},{"args":{"as":"second","key":"balance:alice"},"effects":[],"index":5,"note":null,"op":"READ","reads":[{"from":{"commitTS":2,"writer":"T2"},"key":"balance:alice","why":"visible_committed_at_statement"}],"result":{"absent":false,"value":150},"resumed":false,"scheduledIndex":5,"snapshotTS":0,"status":"ok","stmtTS":2,"storeAfter":[{"key":"balance:alice","versions":[{"commitTS":1,"deleted":false,"value":100,"writer":"T0"},{"commitTS":2,"deleted":false,"value":150,"writer":"T2"}]}],"txn":"T1"},{"args":{},"effects":[{"commitTS":3,"kind":"commit","txn":"T1"}],"index":6,"note":null,"op":"COMMIT","reads":[],"resumed":false,"scheduledIndex":6,"snapshotTS":0,"status":"ok","stmtTS":0,"storeAfter":[{"key":"balance:alice","versions":[{"commitTS":1,"deleted":false,"value":100,"writer":"T0"},{"commitTS":2,"deleted":false,"value":150,"writer":"T2"}]}],"txn":"T1"}],"txns":[{"abortReason":null,"commitTS":3,"id":"T1","snapshotTS":0,"status":"committed"},{"abortReason":null,"commitTS":2,"id":"T2","snapshotTS":0,"status":"committed"}]}