{"digest":"c6ba7a859d0f800b5c3f9715572fd984eb0cb84a18f12683776434d5fd790752","engineVersion":"1.0.0","finalState":[{"key":"emp:1","value":1},{"key":"emp:2","value":1},{"key":"emp:3","value":1}],"invariants":[{"detail":"lhs=2 rhs=2","name":"T1's two counts agree","status":"holds"}],"level":"SER","scenario":{"id":"phantom","invariants":[{"expr":"count(before) == count(after)","name":"T1's two counts agree"}],"story":"T1 counts the employees in a department twice. In between, T2 hires someone and commits.","title":"Phantom: a row appears mid-transaction"},"schemaVersion":1,"serializable":{"verdict":true,"witnessOrder":["T1","T2"]},"setup":[{"key":"emp:1","value":1},{"key":"emp:2","value":1}],"steps":[{"args":{},"effects":[],"index":0,"note":null,"op":"BEGIN","reads":[],"resumed":false,"scheduledIndex":0,"snapshotTS":0,"status":"ok","stmtTS":0,"storeAfter":[{"key":"emp:1","versions":[{"commitTS":1,"deleted":false,"value":1,"writer":"T0"}]},{"key":"emp:2","versions":[{"commitTS":1,"deleted":false,"value":1,"writer":"T0"}]}],"txn":"T1"},{"args":{},"effects":[],"index":1,"note":null,"op":"BEGIN","reads":[],"resumed":false,"scheduledIndex":1,"snapshotTS":0,"status":"ok","stmtTS":0,"storeAfter":[{"key":"emp:1","versions":[{"commitTS":1,"deleted":false,"value":1,"writer":"T0"}]},{"key":"emp:2","versions":[{"commitTS":1,"deleted":false,"value":1,"writer":"T0"}]}],"txn":"T2"},{"args":{"as":"before","prefix":"emp:"},"effects":[],"index":2,"note":null,"op":"SCAN","reads":[{"from":{"commitTS":1,"writer":"T0"},"key":"emp:1","why":"visible_committed_before_snapshot"},{"from":{"commitTS":1,"writer":"T0"},"key":"emp:2","why":"visible_committed_before_snapshot"}],"result":{"count":2,"rows":[{"key":"emp:1","value":1},{"key":"emp:2","value":1}],"sum":2},"resumed":false,"scheduledIndex":2,"snapshotTS":1,"status":"ok","stmtTS":1,"storeAfter":[{"key":"emp:1","versions":[{"commitTS":1,"deleted":false,"value":1,"writer":"T0"}]},{"key":"emp:2","versions":[{"commitTS":1,"deleted":false,"value":1,"writer":"T0"}]}],"txn":"T1"},{"args":{"expr":"1","key":"emp:3","value":1},"effects":[{"key":"emp:3","kind":"lock_acquired","txn":"T2"},{"key":"emp:3","kind":"version_created","txn":"T2","value":1},{"from":"T1","kind":"rw_edge","reason":"rw_edge_added","to":"T2","via":"emp:"}],"index":3,"note":null,"op":"PUT","reads":[],"resumed":false,"scheduledIndex":3,"snapshotTS":1,"status":"ok","stmtTS":1,"storeAfter":[{"key":"emp:1","versions":[{"commitTS":1,"deleted":false,"value":1,"writer":"T0"}]},{"key":"emp:2","versions":[{"commitTS":1,"deleted":false,"value":1,"writer":"T0"}]},{"key":"emp:3","versions":[{"commitTS":0,"deleted":false,"value":1,"writer":"T2"}]}],"txn":"T2"},{"args":{},"effects":[{"commitTS":2,"kind":"commit","txn":"T2"},{"key":"emp:3","kind":"lock_released","txn":"T2"}],"index":4,"note":null,"op":"COMMIT","reads":[],"resumed":false,"scheduledIndex":4,"snapshotTS":1,"status":"ok","stmtTS":0,"storeAfter":[{"key":"emp:1","versions":[{"commitTS":1,"deleted":false,"value":1,"writer":"T0"}]},{"key":"emp:2","versions":[{"commitTS":1,"deleted":false,"value":1,"writer":"T0"}]},{"key":"emp:3","versions":[{"commitTS":2,"deleted":false,"value":1,"writer":"T2"}]}],"txn":"T2"},{"args":{"as":"after","prefix":"emp:"},"effects":[],"index":5,"note":null,"op":"SCAN","reads":[{"from":{"commitTS":1,"writer":"T0"},"key":"emp:1","why":"visible_committed_before_snapshot"},{"from":{"commitTS":1,"writer":"T0"},"key":"emp:2","why":"visible_committed_before_snapshot"},{"from":{"commitTS":2,"writer":"T2"},"key":"emp:3","why":"invisible_newer_than_snapshot"}],"result":{"count":2,"rows":[{"key":"emp:1","value":1},{"key":"emp:2","value":1}],"sum":2},"resumed":false,"scheduledIndex":5,"snapshotTS":1,"status":"ok","stmtTS":2,"storeAfter":[{"key":"emp:1","versions":[{"commitTS":1,"deleted":false,"value":1,"writer":"T0"}]},{"key":"emp:2","versions":[{"commitTS":1,"deleted":false,"value":1,"writer":"T0"}]},{"key":"emp:3","versions":[{"commitTS":2,"deleted":false,"value":1,"writer":"T2"}]}],"txn":"T1"},{"args":{},"effects":[{"commitTS":3,"kind":"commit","txn":"T1"}],"index":6,"note":null,"op":"COMMIT","reads":[],"resumed":false,"scheduledIndex":6,"snapshotTS":1,"status":"ok","stmtTS":0,"storeAfter":[{"key":"emp:1","versions":[{"commitTS":1,"deleted":false,"value":1,"writer":"T0"}]},{"key":"emp:2","versions":[{"commitTS":1,"deleted":false,"value":1,"writer":"T0"}]},{"key":"emp:3","versions":[{"commitTS":2,"deleted":false,"value":1,"writer":"T2"}]}],"txn":"T1"}],"txns":[{"abortReason":null,"commitTS":3,"id":"T1","snapshotTS":1,"status":"committed"},{"abortReason":null,"commitTS":2,"id":"T2","snapshotTS":1,"status":"committed"}]}